[
  {
    "source_platform": "EBAY_AU",
    "listing_title": "MSI Titan 18 HX i9 64GB RTX 4090 Gaming Laptop - Excellent Condition",
    "listing_price_aud": 4200.0,
    "listing_url_or_identifier": "ebay-au:v1029384756",
    "inferred_component_category": "SYSTEM",
    "inferred_model_hint": "MSI Titan 18 HX",
    "inferred_gpu_hint": "RTX 4090",
    "inferred_vram_hint": "16GB (typical RTX 4090 mobile)",
    "inferred_condition_hint": "excellent / like new",
    "discovery_flags": [],
    "discovery_confidence": 0.82
  }
]
